<?xml version="1.0" encoding="UTF-8"?>
<!--
	This file provides the list of quantities and units when the selected
	unit system is None. It has no quantities and no units.
-->
<unitSystem name="None"
            xsi:schemaLocation="http://schemas.mathsoft.com/unit-system30
                                ../schema/UnitSystem30.xsd"
            xmlns="http://schemas.mathsoft.com/unit-system30"
            xmlns:xsi="http://www.w3.org/2001/XMLSchema-instance">
	<quantities>
		<quantity name="M" base-quantity="true" default-unit="M">
			<displayName xml:lang="en">Mass</displayName>
			<displayName xml:lang="ja">質量</displayName>
			<displayName xml:lang="de">Masse</displayName>
			<displayName xml:lang="fr">Masse</displayName>
			<displayName xml:lang="ko">질량</displayName>
			<displayName xml:lang="zh-Hant">質量</displayName>
			<displayName xml:lang="es">Masa</displayName>
			<displayName xml:lang="zh-Hans">质量</displayName>
			<displayName xml:lang="it">Massa</displayName>
		</quantity>
		<quantity name="L" base-quantity="true" default-unit="L">
			<displayName xml:lang="en">Length</displayName>
			<displayName xml:lang="ja">長さ</displayName>
			<displayName xml:lang="de">Länge</displayName>
			<displayName xml:lang="fr">Longueur</displayName>
			<displayName xml:lang="ko">길이</displayName>
			<displayName xml:lang="zh-Hant">長度</displayName>
			<displayName xml:lang="es">Longitud</displayName>
			<displayName xml:lang="zh-Hans">长度</displayName>
			<displayName xml:lang="it">Lunghezza</displayName>
		</quantity>
		<quantity name="T" base-quantity="true" default-unit="T">
			<displayName xml:lang="en">Time</displayName>
			<displayName xml:lang="ja">時間 (または時刻)</displayName>
			<displayName xml:lang="de">Zeit</displayName>
			<displayName xml:lang="fr">Temps</displayName>
			<displayName xml:lang="ko">시(시간)</displayName>
			<displayName xml:lang="zh-Hant">時間</displayName>
			<displayName xml:lang="es">Tiempo</displayName>
			<displayName xml:lang="zh-Hans">单位时间</displayName>
			<displayName xml:lang="it">Tempo</displayName>
		</quantity>
		<quantity name="Q" base-quantity="true" default-unit="Q">
			<displayName xml:lang="en">Current</displayName>
			<displayName xml:lang="ja">電流</displayName>
			<displayName xml:lang="de">Strom</displayName>
			<displayName xml:lang="fr">Courant</displayName>
			<displayName xml:lang="ko">전류</displayName>
			<displayName xml:lang="zh-Hant">電流</displayName>
			<displayName xml:lang="es">Corriente</displayName>
			<displayName xml:lang="zh-Hans">电流</displayName>
			<displayName xml:lang="it">Corrente</displayName>
		</quantity>
		<quantity name="K" base-quantity="true" default-unit="K">
			<displayName xml:lang="en">Temperature</displayName>
			<displayName xml:lang="ja">温度</displayName>
			<displayName xml:lang="de">Temperatur</displayName>
			<displayName xml:lang="fr">Température</displayName>
			<displayName xml:lang="ko">온도</displayName>
			<displayName xml:lang="zh-Hant">溫度</displayName>
			<displayName xml:lang="es">Temperatura</displayName>
			<displayName xml:lang="zh-Hans">温度</displayName>
			<displayName xml:lang="it">Temperatura</displayName>
		</quantity>
		<quantity name="C" base-quantity="true" default-unit="C">
			<displayName xml:lang="en">Luminous Intensity</displayName>
			<displayName xml:lang="ja">光度</displayName>
			<displayName xml:lang="de">Lichtstärke</displayName>
			<displayName xml:lang="fr">Intensité lumineuse</displayName>
			<displayName xml:lang="ko">광도</displayName>
			<displayName xml:lang="zh-Hant">發光強度</displayName>
			<displayName xml:lang="es">Intensidad luminosa</displayName>
			<displayName xml:lang="zh-Hans">发光强度</displayName>
			<displayName xml:lang="it">Intensità luminosa</displayName>
		</quantity>
		<quantity name="S" base-quantity="true" default-unit="S">
			<displayName xml:lang="en">Substance</displayName>
			<displayName xml:lang="ja">物質量</displayName>
			<displayName xml:lang="de">Stoff</displayName>
			<displayName xml:lang="fr">Substance</displayName>
			<displayName xml:lang="ko">물질</displayName>
			<displayName xml:lang="zh-Hant">物質</displayName>
			<displayName xml:lang="es">Sustancia</displayName>
			<displayName xml:lang="zh-Hans">物质</displayName>
			<displayName xml:lang="it">Sostanza</displayName>
		</quantity>
		<quantity name="D" base-quantity="true" default-unit="D">
			<displayName xml:lang="en">Money</displayName>
			<displayName xml:lang="de">Geld</displayName>
			<displayName xml:lang="fr">Argent</displayName>
			<displayName xml:lang="es">Moneda</displayName>
			<displayName xml:lang="it">Valuta</displayName>
			<displayName xml:lang="ja">通貨</displayName>
			<displayName xml:lang="ko">돈</displayName>
			<displayName xml:lang="zh-Hant">貨幣</displayName>
			<displayName xml:lang="zh-Hans">货币</displayName>
		</quantity>
	</quantities>
	<units>
		<unit name="M" quantity-name="M">
			<symbol name="M" xml:lang="en"/>
			<displayName xml:lang="en">M</displayName>
			<displayName xml:lang="ja">+[M]</displayName>
			<displayName xml:lang="de">M</displayName>
			<displayName xml:lang="fr">M</displayName>
			<displayName xml:lang="ko">M</displayName>
			<displayName xml:lang="zh-Hant">M</displayName>
			<displayName xml:lang="es">M</displayName>
			<displayName xml:lang="zh-Hans">M</displayName>
			<displayName xml:lang="it">M</displayName>
		</unit>
		<unit name="L" quantity-name="L">
			<symbol name="L" xml:lang="en"/>
			<displayName xml:lang="en">L</displayName>
			<displayName xml:lang="ja">L</displayName>
			<displayName xml:lang="de">L</displayName>
			<displayName xml:lang="fr">L</displayName>
			<displayName xml:lang="ko">L</displayName>
			<displayName xml:lang="zh-Hant">L</displayName>
			<displayName xml:lang="es">L</displayName>
			<displayName xml:lang="zh-Hans">L</displayName>
			<displayName xml:lang="it">L</displayName>
		</unit>
		<unit name="T" quantity-name="T">
			<symbol name="T" xml:lang="en"/>
			<displayName xml:lang="en">T</displayName>
			<displayName xml:lang="ja">T</displayName>
			<displayName xml:lang="de">T</displayName>
			<displayName xml:lang="fr">T</displayName>
			<displayName xml:lang="ko">T</displayName>
			<displayName xml:lang="zh-Hant">T</displayName>
			<displayName xml:lang="es">T</displayName>
			<displayName xml:lang="zh-Hans">T</displayName>
			<displayName xml:lang="it">T</displayName>
		</unit>
		<unit name="Q" quantity-name="Q">
			<symbol name="Q" xml:lang="en"/>
			<displayName xml:lang="en">Q</displayName>
			<displayName xml:lang="ja">Q</displayName>
			<displayName xml:lang="de">Q</displayName>
			<displayName xml:lang="fr">Q</displayName>
			<displayName xml:lang="ko">Q</displayName>
			<displayName xml:lang="zh-Hant">Q</displayName>
			<displayName xml:lang="es">Q</displayName>
			<displayName xml:lang="zh-Hans">Q</displayName>
			<displayName xml:lang="it">Q</displayName>
		</unit>
		<unit name="K" quantity-name="K">
			<symbol name="K" xml:lang="en"/>
			<displayName xml:lang="en">K</displayName>
			<displayName xml:lang="ja">K</displayName>
			<displayName xml:lang="de">K</displayName>
			<displayName xml:lang="fr">K</displayName>
			<displayName xml:lang="ko">K</displayName>
			<displayName xml:lang="zh-Hant">K</displayName>
			<displayName xml:lang="es">K</displayName>
			<displayName xml:lang="zh-Hans">K</displayName>
			<displayName xml:lang="it">K</displayName>
		</unit>
		<unit name="C" quantity-name="C">
			<symbol name="C" xml:lang="en"/>
			<displayName xml:lang="en">C</displayName>
			<displayName xml:lang="ja">C</displayName>
			<displayName xml:lang="de">C</displayName>
			<displayName xml:lang="fr">C</displayName>
			<displayName xml:lang="ko">C</displayName>
			<displayName xml:lang="zh-Hant">C</displayName>
			<displayName xml:lang="es">C</displayName>
			<displayName xml:lang="zh-Hans">C</displayName>
			<displayName xml:lang="it">C</displayName>
		</unit>
		<unit name="S" quantity-name="S">
			<symbol name="S" xml:lang="en"/>
			<displayName xml:lang="en">S</displayName>
			<displayName xml:lang="ja">+[S]</displayName>
			<displayName xml:lang="de">S</displayName>
			<displayName xml:lang="fr">S</displayName>
			<displayName xml:lang="ko">S</displayName>
			<displayName xml:lang="zh-Hant">S</displayName>
			<displayName xml:lang="es">S</displayName>
			<displayName xml:lang="zh-Hans">S</displayName>
			<displayName xml:lang="it">S</displayName>
		</unit>
		<unit name="D" quantity-name="D">
			<symbol name="D" xml:lang="en"/>
			<displayName xml:lang="en">D</displayName>
			<displayName xml:lang="de">D</displayName>
			<displayName xml:lang="fr">D</displayName>
			<displayName xml:lang="es">D</displayName>
			<displayName xml:lang="it">D</displayName>
			<displayName xml:lang="ja">D</displayName>
			<displayName xml:lang="ko">D</displayName>
			<displayName xml:lang="zh-Hant">D</displayName>
			<displayName xml:lang="zh-Hans">D</displayName>
		</unit>
	</units>
</unitSystem>
